Title,URL,Company,Min-Qualifications,Pref-Qualifications,Description
"
      AI Engineer, Professional Services, Google Cloud
    ",https://careers.google.com/jobs/results/111182134443418310-ai-engineer-professional-services-google-cloud/?distance=50&page=4&q=Machine%20Learning,Google,"
Bachelor's degree in Computer Science, Mathematics, a related technical field, or equivalent practical experience.
5 years of experience working with recommendation engines, data pipelines, or distributed Machine Learning. 
Experience in coding languages (such as Python, Scala, Java, Go, or similar), data structures, algorithms, and software design.
Experience working with technical customers.
","
Experience in learning frameworks (such as l, Torch, Caffe, Theano).
Experience in technical consulting.
Understanding of the auxiliary practical concerns in production ML systems.
Knowledge of data warehousing concepts, including data warehouse technical architectures, infrastructure components, ETL/ ELT and reporting/analytic tools, and environments (such as Apache Beam, Hadoop, Spark, Pig, Hive, MapReduce, Flume).
","The Google Cloud Platform team helps customers transform and build what's next for their business — all with technology built in the cloud. Our products are engineered for security, reliability and scalability, running the full stack from infrastructure to applications to devices and hardware. Our teams are dedicated to helping our customers — developers, small and large businesses, educational institutions and government agencies — see the benefits of our technology come to life. As part of an entrepreneurial team in this rapidly growing business, you will play a key role in understanding the needs of our customers and help shape the future of businesses of all sizes use technology to connect with customers, employees and partners.
Google Cloud accelerates organizations’ ability to digitally transform their business with the best infrastructure, platform, industry solutions and expertise. We deliver enterprise-grade solutions that leverage Google’s cutting-edge technology – all on the cleanest cloud in the industry. Customers in more than 200 countries and territories turn to Google Cloud as their trusted partner to enable growth and solve their most critical business problems.The US base salary range for this full-time position is $134,000-$208,000 + bonus + equity + benefits. Our salary ranges are determined by role, level, and location. The range displayed on each job posting reflects the minimum and maximum target for new hire salaries for the position across all US locations. Within the range, individual pay is determined by work location and additional factors, including job-related skills, experience, and relevant education or training. Your recruiter can share more about the specific salary range for your preferred location during the hiring process.

Please note that the compensation details listed in US role postings reflect the base salary only, and do not include bonus, equity, or benefits."
"
      Software Engineering Intern, PhD, Summer 2023
    ",https://careers.google.com/jobs/results/87534690770002630-software-engineering-intern-phd-summer-2023/?distance=50&page=4&q=Machine%20Learning,Google,"
Pursuing a PhD degree program in Computer Science, or related technical field.
Experience programming in one or more of the following: C/C++, Java, or Python.
","
Research experience in Algorithms, Architecture, Artificial Intelligence, Compilers, Database, Data Mining, Distributed Systems, Machine Learning, Networking or Systems.
Currently attending a degree program in the US with plans to return to the degree program after completion of the internship.
Available to work full time for a minimum of 12 weeks outside of university term time.
Programming experience in one or more of the following: C/C++, C#, Java, JavaScript, Python Objective C, Go, or similar.
Experience in computer science, with knowledge in data structures, algorithms, and software design.
","Join us for a unique 12-14 week paid internship that offers personal and professional development, an executive speaker series, and community-building. The Software Engineering Internship program will give you an opportunity to work on complex computer science solutions, develop scalable, distributed software systems, and also collaborate on multitudes of smaller projects that have universal appeal.
We offer a range of internships in either Software Engineering or Site-Reliability Engineering across North America, including the US and Canada. Our recruitment team will determine where you fit best based on your resume.
As a Software Engineering intern, you will work on a specific project critical to Google’s needs. 
Software Engineering Intern:
As a key member of a versatile team, you will work on a specific project critical to Google’s needs. We need our engineers to be versatile, and enthusiastic in addressing problems as we continue to push technology forward. You will design, test, deploy and maintain software solutions as you grow and evolve during your internship.
Site Reliability Intern:
Our engineers create, fix, extend and scale the code to keep it working and to harden it against all the bad actors of the internet. We drive reliability and performance on a massive scale. You will work on software development projects to keep important business generating-critical systems up and running, from code-level troubleshooting of traffic anomalies to maintenance of our services; from monitoring and alerts to building automation infrastructure. Google is and always will be an engineering company. We hire people with a broad set of technical skills who are ready to address some of technology's greatest challenges and make an impact on millions, if not billions, of users. At Google, engineers not only revolutionize search, they routinely work on massive scalability and storage solutions, large-scale applications and entirely new platforms for developers around the world. From Google Ads to Chrome, Android to YouTube, Social to Local, Google engineers are changing the world one technological achievement after another.
The US base salary range for this full-time position is $105,000-$134,000. Our salary ranges are determined by role, level, and location. The range displayed on each job posting reflects the minimum and maximum target for new hire salaries for the position across all US locations. Within the range, individual pay is determined by work location and additional factors, including job-related skills, experience, and relevant education or training. Your recruiter can share more about the specific salary range for your preferred location during the hiring process.
Please note that the compensation details listed in US role postings reflect the base salary only, and do not include bonus, equity, or benefits."
"
      Scaled Customer Engineer, Google Cloud
    ",https://careers.google.com/jobs/results/112718637250290374-scaled-customer-engineer-google-cloud/?distance=50&page=4&q=Machine%20Learning,Google,"
Bachelor's degree in Computer Science, a related technical field, or equivalent practical experience.
2 years of experience in virtualization or cloud native architectures in a customer-facing or support role.
Experience with cloud technologies and architectures across cloud tools, SaaS, PaaS, and IaaS.
Experience in performing technical presentations or public speaking.
","
MBA or Master's degree in Computer Science.
Experience with technical sales or consulting in cloud computing, data, networking, information life cycle management, or big data.
Experience writing code in development languages (e.g., Java, Python, JavaScript, C++, Go, etc.).
Understanding of DNS, TCP, firewalls, proxy servers, load balancing, VPN, VPC, and working knowledge of Linux.
Familiarity with architecture and operational aspects of large scale distributed systems, including technologies such as Kubernetes, Istio, etc.
Familiarity with the technologies in the machine learning/artificial intelligence ecosystem (e.g., TensorFlow, Spark, Kubeflow, etc.).
","The Google Cloud Platform team helps customers transform and build what's next for their business — all with technology built in the cloud. Our products are engineered for security, reliability and scalability, running the full stack from infrastructure to applications to devices and hardware. Our teams are dedicated to helping our customers — developers, small and large businesses, educational institutions and government agencies — see the benefits of our technology come to life. As part of an entrepreneurial team in this rapidly growing business, you will play a key role in understanding the needs of our customers and help shape the future of businesses of all sizes use technology to connect with customers, employees and partners.
As a Scaled Customer Engineer, you will work with the business team to introduce Google Cloud to our customers. You will help customers and partners understand the power of Google Cloud, develop creative cloud solutions and architectures to solve their business challenges, and solve potential technical roadblocks/challenges.Google Cloud accelerates organizations’ ability to digitally transform their business with the best infrastructure, platform, industry solutions and expertise. We deliver enterprise-grade solutions that leverage Google’s cutting-edge technology – all on the cleanest cloud in the industry. Customers in more than 200 countries and territories turn to Google Cloud as their trusted partner to enable growth and solve their most critical business problems.The US base salary range for this full-time position is $90,500-$135,000 + bonus + equity + benefits. Our salary ranges are determined by role, level, and location. The range displayed on each job posting reflects the minimum and maximum target for new hire salaries for the position across all US locations. Within the range, individual pay is determined by work location and additional factors, including job-related skills, experience, and relevant education or training. Your recruiter can share more about the specific salary range for your preferred location during the hiring process.Please note that the compensation details listed in US role postings reflect the base salary only, and do not include bonus, equity, or benefits."
"
      Software Engineering Manager, Pixel Networking (English, Chinese)
    ",https://careers.google.com/jobs/results/90224827832378054-software-engineering-manager-pixel-networking-english-chinese/?distance=50&page=4&q=Machine%20Learning,Google,"
 Bachelor's degree in Computer Science, Electrical Engineering, Computer Engineering, a related technical field, or equivalent practical experience.
5 years of industry experience, with 3 years of experience in technical leadership and people management.
Experience managing projects in software or software-based networking.
Ability to speak and write  in English and Chinese fluently. 
","
5 years of experience in managing teams within a software development organization.
Experience in designing, implementing, or using networking protocols (IPv4/v6, UDP/TCP, DNS, HTTP, QUIC, TLS, etc.).
Experience in one or more general purpose programming languages such as C/C++, Python, Rust or Go.
Experience in deploying on-device Machine Learning models.
Knowledge of the Linux kernel networking stack and drivers.
","Like Google's own ambitions, the work of a Software Engineer (SWE) goes way beyond just Search. SWE Managers have not only the technical expertise to take on and provide technical leadership to major projects, but also manage a team of engineers. You not only optimize your own code but make sure engineers are able to optimize theirs. As a SWE Manager you manage your project goals, contribute to product strategy and help develop your team. SWE teams work all across the company, in areas such as information retrieval, artificial intelligence, natural language processing, distributed computing, large-scale system design, networking, security, data compression, user interface design; the list goes on and is growing every day. Operating with scale and speed, our exceptional software engineers are just getting started -- and as a manager, you guide the way.
"
"
      Application Engineer, Cloud Supply Chain
    ",https://careers.google.com/jobs/results/124247947199029958-application-engineer-cloud-supply-chain/?distance=50&page=4&q=Machine%20Learning,Google,"
 6 years of experience in systems integration
Experience with Java, JavaScript, Python, Go, C++, or similar language
Experience with leading development teams that develop custom software solutions and integrations in the supply chain domain
Experience interfacing with third-party Enterprise Resource Planning applications and developing custom UI experiences
","
Master's degree in Computer Science or related technical field
10 years of experience with Java, Python, Go, JavaScript, C++, or similar language
5 years of experience leading technical or engineering resources as a team lead
Experience working with Supply Chain Management, Machine Learning, Artificial Intelligence or ERP Systems
Ability to learn and drive implementation and ideation of solutions using technologies like AI/ML, iPaaS and other cloud technologies
","
In this role, you will be responsible for leading and building custom software solutions for Google Cloud Supply Chain users. You will develop a shared direction, strategy, and set priorities for deliverables across our third-party and the first-party products. Additionally, you will influence / drive engineering excellence, standards, and architecture road-maps for the team.Google Cloud accelerates organizations’ ability to digitally transform their business with the best infrastructure, platform, industry solutions and expertise. We deliver enterprise-grade solutions that leverage Google’s cutting-edge technology – all on the cleanest cloud in the industry. Customers in more than 200 countries and territories turn to Google Cloud as their trusted partner to enable growth and solve their most critical business problems.
The US base salary range for this full-time position is $159,000-$252,000 + bonus + equity + benefits. Our salary ranges are determined by role, level, and location. The range displayed on each job posting reflects the minimum and maximum target for new hire salaries for the position across all US locations. Within the range, individual pay is determined by work location and additional factors, including job-related skills, experience, and relevant education or training. Your recruiter can share more about the specific salary range for your preferred location during the hiring process.
Please note that the compensation details listed in US role postings reflect the base salary only, and do not include bonus, equity, or benefits."
"
      Technical Account Manager, Cloud Customer Experience
    ",https://careers.google.com/jobs/results/82035351427654342-technical-account-manager-cloud-customer-experience/?distance=50&page=4&q=Machine%20Learning,Google,"
Bachelor’s degree in computer science, engineering, a related technical field, or equivalent practical experience.
3 years of experience in a customer-facing role, interfacing with executive stakeholders, driving customer technical implementations or transformation programs.
Experience supporting customers in cloud operations (e.g., launch/capacity planning, product release management), technical support, escalation management, or IT consulting.
","
MBA or Master’s degree in a management, technical or engineering field with 7 years of experience in customer-facing.
Experience in application/workload migration to public cloud providers.
Experience collaborating with channel partners, systems integrators, and third-party developers to deliver high-impact solutions.
Experience collaborating across business units internally and at large enterprises.
Experience translating business requirements into technological solutions with excellent communication, presentation, problem-solving, and management skills.
Understanding of one of the following (e.g., IT operations, database systems, networking, IT security, application development, service architecture, cloud-native application development, hosted services, storage systems, or content delivery networks).
","
In this role, you will help customers successfully adopt Google Cloud products. You will lead the successful adoption of Google Cloud at leading organizations, guiding them through the strategic and technical facets of their cloud transformation journey. 

You will manage the successful delivery of Professional Services engagements to drive customer adoption of Google Cloud services, like Google Compute Engine, Google Cloud Machine Learning, Google Kubernetes Engine, BigQuery, Google Workspace, Google Chrome, and more. You will regularly engage with diverse stakeholder groups, including executives of large enterprises and a cross-functional and geographically dispersed team.Google Cloud accelerates organizations’ ability to digitally transform their business with the best infrastructure, platform, industry solutions and expertise. We deliver enterprise-grade solutions that leverage Google’s cutting-edge technology – all on the cleanest cloud in the industry. Customers in more than 200 countries and territories turn to Google Cloud as their trusted partner to enable growth and solve their most critical business problems.The US base salary range for this full-time position is $96,000-$146,000 + bonus + equity + benefits. Our salary ranges are determined by role, level, and location. The range displayed on each job posting reflects the minimum and maximum target for new hire salaries for the position across all US locations. Within the range, individual pay is determined by work location and additional factors, including job-related skills, experience, and relevant education or training. Your recruiter can share more about the specific salary range for your preferred location during the hiring process.Please note that the compensation details listed in US role postings reflect the base salary only, and do not include bonus, equity, or benefits."
"
      Open Career Opportunities, Future Moonshots, X
    ",https://careers.google.com/jobs/results/76351334502015686-open-career-opportunities-future-moonshots-x/?distance=50&page=4&q=Machine%20Learning,Google,N/A,N/A,"There’s no playbook for taking moonshots — and we like it that way. Building things that are on the edge of impossible means we have to embrace ambiguity and be prepared to tinker, experiment, and learn our way into the future. Responsibly irresponsible, we live in the sweet spots between audacity and humility, idealism and pragmatism. We ask hard questions, seek out diverse perspectives, and find inspiration to invent everywhere.Curious, fast-moving, intellectually-honest teams can have enormous impact relative to their size. We are looking for passionate, driven people across functions from engineering and data science, to visual design and fabrication. We look for dreamers who prefer to do things, and want to help millions of people in the process by bringing breakthrough technologies into the world. Explore X open roles on our careers page.Careers at X include: breakthrough technology in robotics, engineering, machine learning, deep learning, data science, AI, aerospace, computer vision, life sciences, manufacturing, program management, and product management, to name a few!"
"
      Data Strategic Cloud Engineer, Professional Services (English, Spanish)
    ",https://careers.google.com/jobs/results/101919979755971270-data-strategic-cloud-engineer-professional-services-english-spanish/?distance=50&page=4&q=Machine%20Learning,Google,"
Experience with programming languages (e.g., Java, Python, Go, JavaScript, C++, etc.).
Experience scripting, working with code, and system design.
Ability to speak and write in English and Spanish fluently.
","
Experience architecting and developing software or Internet scale production-grade Big Data solutions in virtualized environments.
Experience in software development, professional services, solution engineering, and technical consulting with experience in architecting/rolling out technology and solution initiatives.
Experience working on data warehouses (e.g., data warehouse technical architectures, infrastructure components, ETL/ ELT, reporting/analytic tools and environments, data structures, etc.).
Experience designing/deploying Big Data, information retrieval, data mining, or machine learning solutions
","The Google Cloud team helps companies, schools, and government seamlessly make the switch to Google products and supports them along the way. You understand the customer and swiftly problem-solve technical issues to show how our products can make businesses more productive, collaborative, and innovative. You work closely with a cross-functional team of web developers and systems administrators, not to mention a variety of both regional and international customers. Your relationships with customers are crucial in helping Google grow its Cloud business and helping companies around the world innovate.
In this role, you will guide customers on how to store, process, analyze, and explore/visualize data on the Google Cloud Platform. You will work on data migrations and transformational projects. You will work with customers to design large-scale data processing systems, develop data pipelines optimized for scaling, and troubleshoot potential platform issues. You will work closely with product management and product engineering to build and constantly drive excellence in products. You will travel to customer sites to deploy solutions and deliver workshops to educate and empower customers.Google Cloud accelerates organizations’ ability to digitally transform their business with the best infrastructure, platform, industry solutions and expertise. We deliver enterprise-grade solutions that leverage Google’s cutting-edge technology – all on the cleanest cloud in the industry. Customers in more than 200 countries and territories turn to Google Cloud as their trusted partner to enable growth and solve their most critical business problems."
"
      Business Performance Analyst, Public Sector, Google Cloud
    ",https://careers.google.com/jobs/results/90435580803850950-business-performance-analyst-public-sector-google-cloud/?distance=50&page=4&q=Machine%20Learning,Google,"
Bachelor's degree or equivalent practical experience.
5 years of experience in an analytical field, or equivalent consulting, strategy and operations, or other experience.
5 years of experience analyzing data, creating reports, working with SQL and relational databases, and visualization software (e.g., Tableau, Looker, Power BI).
","
MBA or Master's degree.
Experience developing and deploying Machine Learning models on multiple large datasets, and using relevant ML programming (e.g., Python, R).
Experience applying statistical modeling, hypothesis testing, and experimentation to solve business problems.
Understanding of data and networking technologies, the global cloud computing market, and key drivers for growth in the public sector.
","
As a Business Performance Analyst for the Public Sector Business Development Planning and Execution Analysis Team, you will define, land, and execute on our key strategic priorities. You’ll work closely with cross-functional leads across sales, channel, product, systems, and more to drive the development and adoption of data-driven customer acquisition and business development for our public sector customers. In this role, you will collaborate with internal stakeholders and cross-functional teams to solve problems, implement new reporting solutions, and deliver consistently against high standards.Google Cloud accelerates organizations’ ability to digitally transform their business with the best infrastructure, platform, industry solutions and expertise. We deliver enterprise-grade solutions that leverage Google’s cutting-edge technology – all on the cleanest cloud in the industry. Customers in more than 200 countries and territories turn to Google Cloud as their trusted partner to enable growth and solve their most critical business problems.Additional Information:The US base salary range for this full-time position is $135,000-$209,000 + bonus + equity + benefits. Our salary ranges are determined by role, level, and location. The range displayed on each job posting reflects the minimum and maximum target for new hire salaries for the position across all US locations. Within the range, individual pay is determined by work location and additional factors, including job-related skills, experience, and relevant education or training. Your recruiter can share more about the specific salary range for your preferred location during the hiring process. Please note that the compensation details listed in US role postings reflect the base salary only, and do not include bonus, equity, or benefits."
