Title,Date-Scraped,URL,Company,Min-Qualifications,Pref-Qualifications,Description
"
      Student Researcher, MS, 2023
    ",2023-01-08 12:59:19.547358 MDT,https://careers.google.com/jobs/results/100573029022474950-student-researcher-ms-2023/?distance=50&page=3&q=Machine%20Learning,Google,"
Currently enrolled in a Master's degree in Computer Science, Linguistics, Statistics, Biostatistics, Applied Mathematics, Operations Research, Economics, or Natural Sciences.
Experience in one area of computer science (e.g., Natural Language Understanding, Computer Vision, Machine Learning, Deep Learning, Algorithmic Foundations of Optimization, Quantum Information Science, Data Science, Software Engineering, etc.).
","
Currently attending a degree program in the US.
Currently enrolled in a full-time degree program and returning to the program after completion of the internship.
Experience as a researcher, including internships, full-time, or at a lab.
Experience contributing research to communities or efforts, including publishing papers in conferences or journals.
Experience with one or more general purpose programming languages (e.g., C/C++, Java, MATLAB, Go, Python, etc.).
Ability to speak and write in English fluently.
","The Student Researcher Program’s primary objective is to foster academic collaborations with students through research at Google. Join us for a paid Student Researcher position that offers the opportunity to work directly with Google research scientists and engineers on research projects.The Student Researcher Program offers more opportunities for research students to work on critical research projects at Google in a less structured way. The program allows opportunities beyond the limitations of our traditional internship program on aspects such as duration, time commitment, and working location (with options for on-site or remote). The topics student researchers work on tend to be open-ended and exploratory, and don't always have a clear deliverable like a traditional internship would.Google Research is building the next generation of intelligent systems for all Google products. To achieve this, we’re working on projects that utilize the latest computer science techniques developed by skilled software engineers and research scientists. Google Research teams collaborate closely with other teams across Google, maintaining the flexibility and versatility required to adapt new projects and foci that meet the demands of the world's fast-paced business needs.
The US base salary range for this full-time position is $95,000-$113,000. Our salary ranges are determined by role, level, and location. The range displayed on each job posting reflects the minimum and maximum target for new hire salaries for the position across all US locations. Within the range, individual pay is determined by work location and additional factors, including job-related skills, experience, and relevant education or training. Your recruiter can share more about the specific salary range for your preferred location during the hiring process.
Please note that the compensation details listed in US role postings reflect the base salary only, and do not include bonus, equity, or benefits."
"
      Hardware Architecture Modeling Engineer, Accelerators
    ",2023-01-08 12:59:23.659558 MDT,https://careers.google.com/jobs/results/93526200615346886-hardware-architecture-modeling-engineer-accelerators/?distance=50&page=3&q=Machine%20Learning,Google,"
Master's degree in Computer Science, Electrical Engineering, a related field, or equivalent practical experience.
4 years of experience in applying computer architecture principles to solve open-ended problems.
Experience in Computer Architecture performance analysis and optimization.
Experience in developing software systems in modern C++.
","
Experience in analyzing workload performance and creating benchmarks.
Experience in Hardware and Software co-design.
Experience with Python.
Knowledge of processor design, accelerator designs, and mapping Machine Learning models to hardware architectures.
Knowledge of design of digital logic at the Register-Transfer Level (RTL) using Verilog.
","Our computational challenges are so big, complex and unique we can't just purchase off-the-shelf hardware, we've got to make it ourselves. Your team designs and builds the hardware, software and networking technologies that power all of Google's services. As a Hardware Engineer, you design and build the systems that are the heart of the world's largest and most powerful computing infrastructure. You develop from the lowest levels of circuit design to large system design and see those systems all the way through to high volume manufacturing. Your work has the potential to shape the machinery that goes into our cutting-edge data centers affecting millions of Google users.
Developing an Accelerator ASIC is a complex task that requires an understanding of Software workloads, pain points in execution, and effective partitioning of the workload between a general purpose machine and a hardware accelerator. To estimate the benefits of hardware acceleration, flexible architectural models of the accelerator, expressed in a higher level programming language are essential. As the Hardware Architecture Modeling Engineer, you will work with Chip and Software architects to define the important blocks and flows that need to be modeled to provide insights into the behavior of the Accelerator. In this role, you will work with the team to build this model, and use the model for architectural and micro-architectural exploration to help define the Accelerator.Behind everything our users see online is the architecture built by the Technical Infrastructure team to keep it running. From developing and maintaining our data centers to building the next generation of Google platforms, we make Google's product portfolio possible. We're proud to be our engineers' engineers and love voiding warranties by taking things apart so we can rebuild them. We keep our networks up and running, ensuring our users have the best and fastest experience possible.Additional Information:The US base salary range for this full-time position is $119,000-$181,000 + bonus + equity + benefits. Our salary ranges are determined by role, level, and location. The range displayed on each job posting reflects the minimum and maximum target for new hire salaries for the position across all US locations. Within the range, individual pay is determined by work location and additional factors, including job-related skills, experience, and relevant education or training. Your recruiter can share more about the specific salary range for your preferred location during the hiring process. Please note that the compensation details listed in US role postings reflect the base salary only, and do not include bonus, equity, or benefits."
"
      Group Product Manager, Google Cloud
    ",2023-01-08 12:59:27.682164 MDT,https://careers.google.com/jobs/results/89487900564955846-group-product-manager-google-cloud/?distance=50&page=3&q=Machine%20Learning,Google,"
Bachelor's degree or equivalent practical experience.
12 years of product management experience within cloud, SaaS, enterprise, internal tools, or supply chain networks.
5 years of experience building and shipping technical products.
Experience creating product roadmap(s) from conception to launch, driving the product vision, defining the GTM strategy, and leading design discussions.
","
Master’s degree or PhD in a technology or business related field.
Experience managing day-to-day technical and design direction for large scale systems.
Experience in one or more of the following: cloud infrastructure, SaaS, big data, security and privacy, development and operations, or artificial intelligence/machine learning.
Knowledge of multiple functional areas such as Product Management, Engineering, UX/UI, Sales, Customer Support, Finance or Marketing.
Ability to influence multiple stakeholders, achieve strategic goals and evolve product strategy based on research, data, and industry trends.
","At Google, we put our users first. The world is always changing, so we need Product Managers who are continuously adapting and excited to work on products that affect millions of people every day. In this role, you will work cross-functionally to guide products from conception to launch by connecting the technical and business worlds. You can break down complex problems into steps that drive product development.One of the many reasons Google consistently brings innovative, world-changing products to market is because of the collaborative work we do in Product Management. Our team works closely with creative engineers, designers, marketers, etc. to help design and develop technologies that improve access to the world's information.  We're responsible for guiding products throughout the execution cycle, focusing specifically on analyzing, positioning, packaging, promoting, and tailoring our solutions to our users.
Google Cloud helps employees and organizations empower their employees, serve their customers, and build what’s next for their business. As a Google Cloud Group Product Manager, you will drive product strategy and partner closely with cross-functional teams to define and deliver on the next phase of cloud services. Additionally, you will develop product solutions, Mergers and Acquisitions, go-to-market, and business relationships to execute on the market potential and benefits possible from applying Google’s technologies in the enterprise market.By applying to this role, you'll be considered for all teams working on Enterprise, including Google Cloud Platform, Google Workspace, Unified Fulfillment Optimization, Google Cloud Systems, Google Cloud Security, Business Application Platform, Google Cloud AI/ML, Developer Product Group, and Internal Tools.Google Cloud accelerates organizations’ ability to digitally transform their business with the best infrastructure, platform, industry solutions and expertise. We deliver enterprise-grade solutions that leverage Google’s cutting-edge technology – all on the cleanest cloud in the industry. Customers in more than 200 countries and territories turn to Google Cloud as their trusted partner to enable growth and solve their most critical business problems.Additional Information:The US base salary range for this full-time position is $194,000-$292,000 + bonus + equity + benefits. Our salary ranges are determined by role, level, and location. The range displayed on each job posting reflects the minimum and maximum target for new hire salaries for the position across all US locations. Within the range, individual pay is determined by work location and additional factors, including job-related skills, experience, and relevant education or training. Your recruiter can share more about the specific salary range for your preferred location during the hiring process.

Please note that the compensation details listed in US role postings reflect the base salary only, and do not include bonus, equity, or benefits."
"
      Research Scientist, Google Research
    ",2023-01-08 12:59:31.512438 MDT,https://careers.google.com/jobs/results/95907162712089286-research-scientist-google-research/?distance=50&page=3&q=Machine%20Learning,Google,"
PhD degree in Computer Science, a related field, or equivalent practical experience. 
One or more scientific publication submission(s) for conferences, journals, or public repositories.
","
2 years of coding experience. 
1 year of experience owning and initiating research agendas.
","As an organization, Google maintains a portfolio of research projects driven by fundamental research, new product innovation, product contribution and infrastructure goals, while providing individuals and teams the freedom to emphasize specific types of work. As a Research Scientist, you'll setup large-scale tests and deploy promising ideas quickly and broadly, managing deadlines and deliverables while applying the latest theories to develop new and improved products, processes, or technologies. From creating experiments and prototyping implementations to designing new architectures, our research scientists work on real-world problems that span the breadth of computer science, such as machine (and deep) learning, data mining, natural language processing, hardware and software performance analysis, improving compilers for mobile platforms, as well as core search and much more.As a Research Scientist, you'll also actively contribute to the wider research community by sharing and publishing your findings, with ideas inspired by internal projects as well as from collaborations with research programs at partner universities and technical institutes all over the world.
Google Research is building the next generation of intelligent systems for all Google products. To achieve this, we’re working on projects that utilize the latest computer science techniques developed by skilled software engineers and research scientists. Google Research teams collaborate closely with other teams across Google, maintaining the flexibility and versatility required to adapt new projects and foci that meet the demands of the world's fast-paced business needs.The US base salary range for this full-time position is $126,000-$190,000 + bonus + equity + benefits. Our salary ranges are determined by role, level, and location. The range displayed on each job posting reflects the minimum and maximum target for new hire salaries for the position across all US locations. Within the range, individual pay is determined by work location and additional factors, including job-related skills, experience, and relevant education or training. Your recruiter can share more about the specific salary range for your preferred location during the hiring process. Please note that the compensation details listed in US role postings reflect the base salary only, and do not include bonus, equity, or benefits."
"
      Software Engineer, Embedded Systems, Silicon
    ",2023-01-08 12:59:35.987758 MDT,https://careers.google.com/jobs/results/111637298098905798-software-engineer-embedded-systems-silicon/?distance=50&page=3&q=Machine%20Learning,Google,"
Master's degree in Electrical Engineering, Computer Science, relevant technical field or equivalent practical experience.
Experience coding in C or C++.
","
Experience in ARM architecture and standard interfaces, bare-metal programming, bootloader, and firmware.
Experience in Linux kernel, device drivers, and Android system programming.
Experience in software/hardware integration.
Experience in optimizing algorithms with OpenGL/OpenCL/NEON/LLVM on CPU/TPU/GPU/DSP.
Verification experience using FPGAs and/or emulation platforms.
Familiarity with computer architecture, compilers, machine learning, or image processing.
","Google's software engineers develop the next-generation technologies that change how billions of users connect, explore, and interact with information and one another. Our products need to handle information at massive scale, and extend well beyond web search. We're looking for engineers who bring fresh ideas from all areas, including information retrieval, distributed computing, large-scale system design, networking and data storage, security, artificial intelligence, natural language processing, UI design and mobile; the list goes on and is growing every day. As a software engineer, you will work on a specific project critical to Google’s needs with opportunities to switch teams and projects as you and our fast-paced business grow and evolve. We need our engineers to be versatile, display leadership qualities and be enthusiastic to take on new problems across the full-stack as we continue to push technology forward.
Google's mission is to organize the world's information and make it universally accessible and useful. Our team combines the best of Google AI, Software, and Hardware to create radically helpful experiences. We research, design, and develop new technologies and hardware to make computing faster, seamless, and more powerful. We aim to make people's lives better through technology."
"
      Engineering Director, Editors Intelligence
    ",2023-01-08 12:59:40.811426 MDT,https://careers.google.com/jobs/results/104969954882659014-engineering-director-editors-intelligence/?distance=50&page=3&q=Machine%20Learning,Google,"
15 years of professional experience in engineering.
Experience as a technical leader with influencing multiple teams of engineers and partnering on development initiatives.
Experience creating roadmaps for execution including timelines and projected engineering resources.
Experience building ML capabilities and bringing them to user-facing products.
","
Master's degree or PhD in Computer Science or Engineering or equivalent practical experience.
Experience innovating with exceptional technology at scale, while motivating others to act by creating a shared sense of vision and purpose.
Experience in a people management role, with technical innovation.
Ability to quickly grasp technical concepts and understand complex interdependencies of a large-scale infrastructure.
","Google Workspace is a cloud-based productivity suite that is revolutionizing the way people communicate and collaborate with one another. Serving over billions of active users across the globe, our team is focused on delivering the tools that shape people’s experience at home, school, and work.The Editors (e.g., Docs, Sheets, Slides, Sites, Keep, Forms) apps play a critical role by enabling users to create, collaborate, and produce content to bring transparency, collaboration, and ultimately productivity to every aspect of life. The products serve a rapidly growing set of users globally across consumer, education and enterprise world. We aim to build simple, intuitive, and smart products that help users at the right time in the right place.The Editors Intelligence team is responsible for applying cutting edge Machine Learning (ML) and Artificial Intelligence (AI) capabilities into the Editors products.As an Engineering Director of Editors Intelligence, you will work closely with product, design, and program management partners as well as other engineering leads to define the strategy, discuss priorities, and cultivate a highly collaborative and effective cross functional team. Technical scope includes intelligence features across the Editors products, common ML infrastructure, and ML integrity. You will define the intelligence strategy for the Editors organization and directly lead a growing team full of experts in their domains. Google Cloud accelerates organizations’ ability to digitally transform their business with the best infrastructure, platform, industry solutions and expertise. We deliver enterprise-grade solutions that leverage Google’s cutting-edge technology – all on the cleanest cloud in the industry. Customers in more than 200 countries and territories turn to Google Cloud as their trusted partner to enable growth and solve their most critical business problems."
"
      Software Test Engineer Silicon Software
    ",2023-01-08 12:59:46.378882 MDT,https://careers.google.com/jobs/results/106958764621341382-software-test-engineer-silicon-software/?distance=50&page=3&q=Machine%20Learning,Google,"
Bachelor's degree in Computer Science or equivalent practical experience.
3 years of experience in developing test automation (e,g., C++, Java, or Python).
","
Experience working with prototype devices.
Experience with Linux kernel driver development.
Experience testing embedded systems.
Experience with Android application development and interactive camera applications.
Excellent programming skills in Java, C/C++, python and Java Native Interface.
","
In this role, you will focus on testing of system software. You will partner with cross functional teams to deliver high quality, power and performance optimized software to enable the best user experience on Pixel and other hardware products. The Silicon Software team builds firmware, drivers, runtime, and compilers to bring our custom hardware to life. We work cross-functionally with many teams, including Research, Machine Learning, Android, Chrome, and Hardware. You will bring enthusiasm for software testing and expertise in embedded to implement testing strategies, promote good software engineering practices, and build out our testing infrastructure and test content. Our testing needs range from traditional software tests to complex on-device testing of full Android applications.Google's mission is to organize the world's information and make it universally accessible and useful. Our team combines the best of Google AI, Software, and Hardware to create radically helpful experiences. We research, design, and develop new technologies and hardware to make computing faster, seamless, and more powerful. We aim to make people's lives better through technology."
"
      Customer Engineer, Data Specialist, Enterprise
    ",2023-01-08 12:59:51.819411 MDT,https://careers.google.com/jobs/results/101472257332650694-customer-engineer-data-specialist-enterprise/?distance=50&page=3&q=Machine%20Learning,Google,"
Bachelor's degree in Computer Science, a related technical field, or equivalent practical experience.
4 years of experience in customer-facing role (e.g., pre-sales engineer, consultant, professional services).
Experience in data and information management as it relates to Business Intelligence Application (Tableau, Microstrategy, PowerBI), Data Processing (Informatica, Talend), or Data Analytics Platform (Hadoop/Spark, Netezza, Teradata).
","
Master's degree in Computer Science, or a related technical field.
Experience with Big Data, Platform-as-a-Service (PaaS), and Infrastructure-as-a-Service (IaaS) technologies.
Experience supporting high touch sales for enterprise as pre-sales engineer for wide portfolio of data lifecycle.
Experience in application development and integration.
Experience in software development platforms and solutions in J2EE, Java servlets, Python, Go or AJAX.
Experience discussing the value of machine learning with customer.
","
In this role, you will work with Sales teams as a data analytics solutions subject matter expert. You will help prospective customers and partners to understand Google Cloud with translating technical value to business value, explaining technical features, helping customers design architectures, engage in proof of concepts, and troubleshoot potential roadblocks related to analytics workloads and projects. You will transform customer business with the power of data, using Google Cloud's unique technology, such as BigQuery, Cloud Dataflow, Data Catalog etc."
