Title,Date-Scraped,URL,Company,Min-Qualifications,Pref-Qualifications,Description
"
      Software Engineer, University Graduate, 2023
    ",2023-01-08 13:00:37.231486 MDT,https://careers.google.com/jobs/results/125320247524631238-software-engineer-university-graduate-2023/?distance=50&page=4&q=Machine%20Learning,X,"
Bachelor's degree in Computer Science, related technical field, or equivalent practical experience.
Experience in computer science, data structures, algorithms and software design.
Experience in Software Development and coding in a general purpose programming language (e.g., Java, JavaScript, Python, C/C++, etc.).
","
Experience programming in C, C++, Java, and/or Python.
Experience with Unix/Linux or Windows environments, distributed systems, machine learning, information retrieval, and TCP/IP.
","Google's software engineers develop the next-generation technologies that change how billions of users connect, explore, and interact with information and one another. Our products need to handle information at massive scale, and extend well beyond web search. We're looking for engineers who bring fresh ideas from all areas, including information retrieval, distributed computing, large-scale system design, networking and data storage, security, artificial intelligence, natural language processing, UI design and mobile; the list goes on and is growing every day. As a software engineer, you will work on a specific project critical to Google’s needs with opportunities to switch teams and projects as you and our fast-paced business grow and evolve. We need our engineers to be versatile, display leadership qualities and be enthusiastic to take on new problems across the full-stack as we continue to push technology forward.As a key member of a small and versatile team, you design, test, deploy and maintain software solutions.Google is an engineering company at heart. We hire people with a broad set of technical skills who are ready to take on some of technology's greatest challenges and make an impact on users around the world. At Google, engineers not only revolutionize search, they routinely work on scalability and storage solutions, large-scale applications and entirely new platforms for developers around the world. From Google Ads to Chrome, Android to YouTube, social to local, Google engineers are changing the world one technological achievement after another."
"
      Director, Engineering, Search Analytics Data Warehouse
    ",2023-01-08 13:00:40.923712 MDT,https://careers.google.com/jobs/results/80101882778788550-director-engineering-search-analytics-data-warehouse/?distance=50&page=4&q=Machine%20Learning,X,"
Bachelor’s degree in Computer Science, Engineering, or equivalent practical experience.

15 years of engineering experience, including 10 years of experience leading engineering teams building user-facing products, technical infrastructure, and supporting data systems.

Experience at global organizations with cross-functional, product, or engineering elements.

Experience managing multiple stakeholders and completing projects.

","
Ability to analyze organizational issues, technical matters, or data analysis in order to draw insights, steer, and coach teams in the right direction.

Ability to influence at all levels of the organization.

Ability to foster innovation by leading teams with a growth mindset of experimentation, learning, and iteration.
Ability to commit to continuously improving engineering development practices and processes.
Open, engaging, and collaborative style, with the ability to represent and respect Google values in all interactions, with excellent global leadership, organizational, and communication skills.
Comfortable with ambiguity and change management.
","Search Analytics Data Warehouse is a data platform for strategic analysis, experiment analysis, and Machine Learning for ranking systems. We are responsible for data modeling and schema representation, data processing, storage optimization, and access to the data. In the last few years we have innovated in the areas of real-time and incremental processing, optimized materializations for faster query speed, and differential access controls for data protection, and insider risk mitigation. Our goal is to become an offering for policy compliant analytics data for Search and Assistant.

We partner closely with large infrastructure organizations, driving their requirements. In order to ensure our analytics platform is addressing the business needs of Search business areas, we work closely with internal customers, (i.e., Data Scientists, Product Owners, and Business leads of Search business area). One of the key areas we want to make faster progress in is the complex compliance space to maintain and increase user trust at scale. In this role, you will be a leader with General Manager skills with a solid foundation in engineering. You will work with Product and Program Management to shape decisions, create customer feedback loops, define roadmap and strategy, and set up effective programs.The US base salary range for this full-time position is $256,000-$384,000 + bonus + equity + benefits. Our salary ranges are determined by role, level, and location. The range displayed on each job posting reflects the minimum and maximum target for new hire salaries for the position across all US locations. Within the range, individual pay is determined by work location and additional factors, including job-related skills, experience, and relevant education or training. Your recruiter can share more about the specific salary range for your preferred location during the hiring process.Please note that the compensation details listed in US role postings reflect the base salary only, and do not include bonus, equity, or benefits."
"
      Trust and Compliance Business Analytics Lead, YouTube
    ",2023-01-08 13:00:44.533299 MDT,https://careers.google.com/jobs/results/88072695687586502-trust-and-compliance-business-analytics-lead-youtube/?distance=50&page=4&q=Machine%20Learning,X,"
Bachelor's degree or equivalent practical experience.  
8 years of experience in management consulting, investment banking, business intelligence, data science, or corporate strategy.
3 years of management experience leading or managing teams of analysts.
Experience working with SQL across datasets and risk, analytics, or dynamics in online platforms.
","
Experience with understanding complex engineering and operations systems including Machine Learning classification and data infrastructure.
Experience collecting, managing, and synthesizing large data sets and information from disparate sources, statistical modeling, data mining, and data analysis.
Experience in consultative problem solving and excellent project management, coupled with strengths in metrics analysis, experiment design, and automation.
Knowledge of optimizing vendor operations at scale across policy labeling or decisions.
People management skills with a track record of problem solving and a quantitative mind, capable of translating analytical insights into business strategies and actions.
","Fast-paced, dynamic, and proactive, YouTube’s Trust & Safety team is dedicated to making YouTube a safe place for users, viewers, and content creators around the world to belong, create, and express themselves. Whether understanding and solving their online content concerns, navigating within global legal frameworks, or writing and enforcing worldwide policy, the Trust & Safety team is on the frontlines of enhancing the YouTube experience, building internet safety, and protecting free speech in our ever-evolving digital world.
In this role, you are responsible for formulating metric strategies and implementing analytical solutions to improve transparency across YouTube with Key Opinion Former, Governments, and our End Users.This includes leading a highly capable team of analysts to develop KPI and measurement across trust and safety operations, building out external narratives and reporting, developing experimentation and analysis to understand key business questions, and drive insights at an executive level to improve our business operations. You will be working cross-functionally and engaging with stakeholders from policy, operations, legal, engineering and product teams to co-own strategy and address a wide variety of complex issues such as reviewer efficiency, decision quality, enforcement timeliness, and violation risk.This role will require managing teams across different time zones as well as some on call/escalation work.At YouTube, we believe that everyone deserves to have a voice, and that the world is a better place when we listen, share, and build community through our stories. We work together to give everyone the power to share their story, explore what they love, and connect with one another in the process. Working at the intersection of cutting-edge technology and boundless creativity, we move at the speed of culture with a shared goal to show people the world. We explore new ideas, solve real problems, and have fun — and we do it all together. Salary Range Info: The US base salary range for this full-time position is $192,000-$288,000 + bonus + equity + benefits. Our salary ranges are determined by role, level, and location. The range displayed on each job posting reflects the minimum and maximum target for new hire salaries for the position across all US locations. Within the range, individual pay is determined by work location and additional factors, including job-related skills, experience, and relevant education or training. Your recruiter can share more about the specific salary range for your preferred location during the hiring process. Please note that the compensation details listed in US role postings reflect the base salary only, and do not include bonus, equity, or benefits."
"
      Senior Tech Lead, Software Engineering
    ",2023-01-08 13:00:48.240794 MDT,https://careers.google.com/jobs/results/115216257503896262-senior-tech-lead-software-engineering/?distance=50&page=4&q=Machine%20Learning,X,"
Bachelor's degree in Computer Science, a related technical field, or equivalent practical experience.
15 years of software development experience with one or more general purpose programming languages, including but not limited to: Java, C/C++, C#, Objective C, Python, JavaScript, or Go.
Ability to speak and write in English fluently.
","
6 years of experience in a technical leadership position.
5 years of experience managing a team of Software Engineers.
Experience designing and implementing any of the following: large-scale distributed systems, APIs used by other developers, Search Ranking systems, ML (Machine Learning) systems.
","Google's software engineers develop the next-generation technologies that change how users connect, explore, and interact with information and one another. Our products need to handle information at massive scale, and extend well beyond web search. We're looking for engineers who bring fresh ideas from all areas, including information retrieval, distributed computing, large-scale system design, networking and data storage, security, artificial intelligence, natural language processing, UI design and mobile; the list goes on and is growing every day. As a software engineer, you will work on a specific project critical to Google’s needs with opportunities to switch teams and projects as you and our fast-paced business grow and evolve. We need our engineers to be versatile, display leadership qualities and be enthusiastic to take on new problems across the full-stack as we continue to push technology forward.
Google aspires to be an organization that reflects the globally diverse audience that our products and technology serve. We believe that in addition to hiring the best talent, a diversity of perspectives, ideas, and cultures leads to the creation of better products and services.Google is an engineering company at heart. We hire people with a broad set of technical skills who are ready to take on some of technology's greatest challenges and make an impact on users around the world. At Google, engineers not only revolutionize search, they routinely work on scalability and storage solutions, large-scale applications and entirely new platforms for developers around the world. From Google Ads to Chrome, Android to YouTube, social to local, Google engineers are changing the world one technological achievement after another."
"
      AI Engineer, Professional Services, Google Cloud
    ",2023-01-08 13:00:51.931101 MDT,https://careers.google.com/jobs/results/111182134443418310-ai-engineer-professional-services-google-cloud/?distance=50&page=4&q=Machine%20Learning,X,"
Bachelor's degree in Computer Science, Mathematics, a related technical field, or equivalent practical experience.
5 years of experience working with recommendation engines, data pipelines, or distributed Machine Learning. 
Experience in coding languages (such as Python, Scala, Java, Go, or similar), data structures, algorithms, and software design.
Experience working with technical customers.
","
Experience in learning frameworks (such as l, Torch, Caffe, Theano).
Experience in technical consulting.
Understanding of the auxiliary practical concerns in production ML systems.
Knowledge of data warehousing concepts, including data warehouse technical architectures, infrastructure components, ETL/ ELT and reporting/analytic tools, and environments (such as Apache Beam, Hadoop, Spark, Pig, Hive, MapReduce, Flume).
","The Google Cloud Platform team helps customers transform and build what's next for their business — all with technology built in the cloud. Our products are engineered for security, reliability and scalability, running the full stack from infrastructure to applications to devices and hardware. Our teams are dedicated to helping our customers — developers, small and large businesses, educational institutions and government agencies — see the benefits of our technology come to life. As part of an entrepreneurial team in this rapidly growing business, you will play a key role in understanding the needs of our customers and help shape the future of businesses of all sizes use technology to connect with customers, employees and partners.
Google Cloud accelerates organizations’ ability to digitally transform their business with the best infrastructure, platform, industry solutions and expertise. We deliver enterprise-grade solutions that leverage Google’s cutting-edge technology – all on the cleanest cloud in the industry. Customers in more than 200 countries and territories turn to Google Cloud as their trusted partner to enable growth and solve their most critical business problems.The US base salary range for this full-time position is $134,000-$208,000 + bonus + equity + benefits. Our salary ranges are determined by role, level, and location. The range displayed on each job posting reflects the minimum and maximum target for new hire salaries for the position across all US locations. Within the range, individual pay is determined by work location and additional factors, including job-related skills, experience, and relevant education or training. Your recruiter can share more about the specific salary range for your preferred location during the hiring process.

Please note that the compensation details listed in US role postings reflect the base salary only, and do not include bonus, equity, or benefits."
"
      Software Engineering Intern, PhD, Summer 2023
    ",2023-01-08 13:00:55.599172 MDT,https://careers.google.com/jobs/results/87534690770002630-software-engineering-intern-phd-summer-2023/?distance=50&page=4&q=Machine%20Learning,X,"
Pursuing a PhD degree program in Computer Science, or related technical field.
Experience programming in one or more of the following: C/C++, Java, or Python.
","
Research experience in Algorithms, Architecture, Artificial Intelligence, Compilers, Database, Data Mining, Distributed Systems, Machine Learning, Networking or Systems.
Currently attending a degree program in the US with plans to return to the degree program after completion of the internship.
Available to work full time for a minimum of 12 weeks outside of university term time.
Programming experience in one or more of the following: C/C++, C#, Java, JavaScript, Python Objective C, Go, or similar.
Experience in computer science, with knowledge in data structures, algorithms, and software design.
","Join us for a unique 12-14 week paid internship that offers personal and professional development, an executive speaker series, and community-building. The Software Engineering Internship program will give you an opportunity to work on complex computer science solutions, develop scalable, distributed software systems, and also collaborate on multitudes of smaller projects that have universal appeal.
We offer a range of internships in either Software Engineering or Site-Reliability Engineering across North America, including the US and Canada. Our recruitment team will determine where you fit best based on your resume.
As a Software Engineering intern, you will work on a specific project critical to Google’s needs. 
Software Engineering Intern:
As a key member of a versatile team, you will work on a specific project critical to Google’s needs. We need our engineers to be versatile, and enthusiastic in addressing problems as we continue to push technology forward. You will design, test, deploy and maintain software solutions as you grow and evolve during your internship.
Site Reliability Intern:
Our engineers create, fix, extend and scale the code to keep it working and to harden it against all the bad actors of the internet. We drive reliability and performance on a massive scale. You will work on software development projects to keep important business generating-critical systems up and running, from code-level troubleshooting of traffic anomalies to maintenance of our services; from monitoring and alerts to building automation infrastructure. Google is and always will be an engineering company. We hire people with a broad set of technical skills who are ready to address some of technology's greatest challenges and make an impact on millions, if not billions, of users. At Google, engineers not only revolutionize search, they routinely work on massive scalability and storage solutions, large-scale applications and entirely new platforms for developers around the world. From Google Ads to Chrome, Android to YouTube, Social to Local, Google engineers are changing the world one technological achievement after another.
The US base salary range for this full-time position is $105,000-$134,000. Our salary ranges are determined by role, level, and location. The range displayed on each job posting reflects the minimum and maximum target for new hire salaries for the position across all US locations. Within the range, individual pay is determined by work location and additional factors, including job-related skills, experience, and relevant education or training. Your recruiter can share more about the specific salary range for your preferred location during the hiring process.
Please note that the compensation details listed in US role postings reflect the base salary only, and do not include bonus, equity, or benefits."
"
      Scaled Customer Engineer, Google Cloud
    ",2023-01-08 13:00:59.237331 MDT,https://careers.google.com/jobs/results/112718637250290374-scaled-customer-engineer-google-cloud/?distance=50&page=4&q=Machine%20Learning,X,"
Bachelor's degree in Computer Science, a related technical field, or equivalent practical experience.
2 years of experience in virtualization or cloud native architectures in a customer-facing or support role.
Experience with cloud technologies and architectures across cloud tools, SaaS, PaaS, and IaaS.
Experience in performing technical presentations or public speaking.
","
MBA or Master's degree in Computer Science.
Experience with technical sales or consulting in cloud computing, data, networking, information life cycle management, or big data.
Experience writing code in development languages (e.g., Java, Python, JavaScript, C++, Go, etc.).
Understanding of DNS, TCP, firewalls, proxy servers, load balancing, VPN, VPC, and working knowledge of Linux.
Familiarity with architecture and operational aspects of large scale distributed systems, including technologies such as Kubernetes, Istio, etc.
Familiarity with the technologies in the machine learning/artificial intelligence ecosystem (e.g., TensorFlow, Spark, Kubeflow, etc.).
","The Google Cloud Platform team helps customers transform and build what's next for their business — all with technology built in the cloud. Our products are engineered for security, reliability and scalability, running the full stack from infrastructure to applications to devices and hardware. Our teams are dedicated to helping our customers — developers, small and large businesses, educational institutions and government agencies — see the benefits of our technology come to life. As part of an entrepreneurial team in this rapidly growing business, you will play a key role in understanding the needs of our customers and help shape the future of businesses of all sizes use technology to connect with customers, employees and partners.
As a Scaled Customer Engineer, you will work with the business team to introduce Google Cloud to our customers. You will help customers and partners understand the power of Google Cloud, develop creative cloud solutions and architectures to solve their business challenges, and solve potential technical roadblocks/challenges.Google Cloud accelerates organizations’ ability to digitally transform their business with the best infrastructure, platform, industry solutions and expertise. We deliver enterprise-grade solutions that leverage Google’s cutting-edge technology – all on the cleanest cloud in the industry. Customers in more than 200 countries and territories turn to Google Cloud as their trusted partner to enable growth and solve their most critical business problems.The US base salary range for this full-time position is $90,500-$135,000 + bonus + equity + benefits. Our salary ranges are determined by role, level, and location. The range displayed on each job posting reflects the minimum and maximum target for new hire salaries for the position across all US locations. Within the range, individual pay is determined by work location and additional factors, including job-related skills, experience, and relevant education or training. Your recruiter can share more about the specific salary range for your preferred location during the hiring process.Please note that the compensation details listed in US role postings reflect the base salary only, and do not include bonus, equity, or benefits."
"
      Software Engineering Manager, Pixel Networking (English, Chinese)
    ",2023-01-08 13:01:02.883187 MDT,https://careers.google.com/jobs/results/90224827832378054-software-engineering-manager-pixel-networking-english-chinese/?distance=50&page=4&q=Machine%20Learning,X,"
 Bachelor's degree in Computer Science, Electrical Engineering, Computer Engineering, a related technical field, or equivalent practical experience.
5 years of industry experience, with 3 years of experience in technical leadership and people management.
Experience managing projects in software or software-based networking.
Ability to speak and write  in English and Chinese fluently. 
","
5 years of experience in managing teams within a software development organization.
Experience in designing, implementing, or using networking protocols (IPv4/v6, UDP/TCP, DNS, HTTP, QUIC, TLS, etc.).
Experience in one or more general purpose programming languages such as C/C++, Python, Rust or Go.
Experience in deploying on-device Machine Learning models.
Knowledge of the Linux kernel networking stack and drivers.
","Like Google's own ambitions, the work of a Software Engineer (SWE) goes way beyond just Search. SWE Managers have not only the technical expertise to take on and provide technical leadership to major projects, but also manage a team of engineers. You not only optimize your own code but make sure engineers are able to optimize theirs. As a SWE Manager you manage your project goals, contribute to product strategy and help develop your team. SWE teams work all across the company, in areas such as information retrieval, artificial intelligence, natural language processing, distributed computing, large-scale system design, networking, security, data compression, user interface design; the list goes on and is growing every day. Operating with scale and speed, our exceptional software engineers are just getting started -- and as a manager, you guide the way.
"
