Title,URL,Company,Min-Qualifications,Pref-Qualifications,Description
"
      Engineering Director, Editors Intelligence
    ",https://careers.google.com/jobs/results/104969954882659014-engineering-director-editors-intelligence/?distance=50&page=3&q=Machine%20Learning,Google,"
15 years of professional experience in engineering.
Experience as a technical leader with influencing multiple teams of engineers and partnering on development initiatives.
Experience creating roadmaps for execution including timelines and projected engineering resources.
Experience building ML capabilities and bringing them to user-facing products.
","
Master's degree or PhD in Computer Science or Engineering or equivalent practical experience.
Experience innovating with exceptional technology at scale, while motivating others to act by creating a shared sense of vision and purpose.
Experience in a people management role, with technical innovation.
Ability to quickly grasp technical concepts and understand complex interdependencies of a large-scale infrastructure.
","Google Workspace is a cloud-based productivity suite that is revolutionizing the way people communicate and collaborate with one another. Serving over billions of active users across the globe, our team is focused on delivering the tools that shape people’s experience at home, school, and work.The Editors (e.g., Docs, Sheets, Slides, Sites, Keep, Forms) apps play a critical role by enabling users to create, collaborate, and produce content to bring transparency, collaboration, and ultimately productivity to every aspect of life. The products serve a rapidly growing set of users globally across consumer, education and enterprise world. We aim to build simple, intuitive, and smart products that help users at the right time in the right place.The Editors Intelligence team is responsible for applying cutting edge Machine Learning (ML) and Artificial Intelligence (AI) capabilities into the Editors products.As an Engineering Director of Editors Intelligence, you will work closely with product, design, and program management partners as well as other engineering leads to define the strategy, discuss priorities, and cultivate a highly collaborative and effective cross functional team. Technical scope includes intelligence features across the Editors products, common ML infrastructure, and ML integrity. You will define the intelligence strategy for the Editors organization and directly lead a growing team full of experts in their domains. Google Cloud accelerates organizations’ ability to digitally transform their business with the best infrastructure, platform, industry solutions and expertise. We deliver enterprise-grade solutions that leverage Google’s cutting-edge technology – all on the cleanest cloud in the industry. Customers in more than 200 countries and territories turn to Google Cloud as their trusted partner to enable growth and solve their most critical business problems."
"
      Customer Engineer, Data Specialist, Enterprise
    ",https://careers.google.com/jobs/results/101472257332650694-customer-engineer-data-specialist-enterprise/?distance=50&page=3&q=Machine%20Learning,Google,"
Bachelor's degree in Computer Science, a related technical field, or equivalent practical experience.
4 years of experience in customer-facing role (e.g., pre-sales engineer, consultant, professional services).
Experience in data and information management as it relates to Business Intelligence Application (Tableau, Microstrategy, PowerBI), Data Processing (Informatica, Talend), or Data Analytics Platform (Hadoop/Spark, Netezza, Teradata).
","
Master's degree in Computer Science, or a related technical field.
Experience with Big Data, Platform-as-a-Service (PaaS), and Infrastructure-as-a-Service (IaaS) technologies.
Experience supporting high touch sales for enterprise as pre-sales engineer for wide portfolio of data lifecycle.
Experience in application development and integration.
Experience in software development platforms and solutions in J2EE, Java servlets, Python, Go or AJAX.
Experience discussing the value of machine learning with customer.
","
In this role, you will work with Sales teams as a data analytics solutions subject matter expert. You will help prospective customers and partners to understand Google Cloud with translating technical value to business value, explaining technical features, helping customers design architectures, engage in proof of concepts, and troubleshoot potential roadblocks related to analytics workloads and projects. You will transform customer business with the power of data, using Google Cloud's unique technology, such as BigQuery, Cloud Dataflow, Data Catalog etc."
"
      Technical Account Manager, Google Cloud Customer Experience
    ",https://careers.google.com/jobs/results/122519783221404358-technical-account-manager-google-cloud-customer-experience/?distance=50&page=3&q=Machine%20Learning,Google,"
Bachelor’s degree in Computer Science, Engineering, a related technical field, or equivalent practical experience.
3 years of experience in a customer-facing role, interfacing with executive stakeholders, or leading customer technical implementations or transformation programs.
Experience supporting customers in cloud operations, technical support, escalation management, or IT consulting.
","
MBA or Master’s degree in a management, technical, or engineering field.
7 years of experience in customer-facing role.
Experience translating business requirements into technological solutions, collaborating with channel partners, systems integrators, and third-party developers to deliver high-impact solutions.
Experience collaborating across business units internally and with enterprises, and experience in application or workload migration to public cloud providers.
Understanding of one of the following: IT operations, database systems, networking, IT security, application development, service architecture, cloud-native application development, hosted services, storage systems, or content delivery networks.
Excellent communication, presentation, problem-solving, and management skills.
","
As the Technical Account Manager, you will help customers successfully adopt Google Cloud products, and guide them through the strategic and technical facets of their cloud transformation journey. 

You will manage the successful delivery of Professional Services engagements to lead customer adoption of Google Cloud services, like Google Compute Engine, Google Cloud Machine Learning, and more. You will engage with diverse stakeholder groups, including executives of enterprises, and a cross-functional and geographically dispersed team.Google Cloud accelerates organizations’ ability to digitally transform their business with the best infrastructure, platform, industry solutions and expertise. We deliver enterprise-grade solutions that leverage Google’s cutting-edge technology – all on the cleanest cloud in the industry. Customers in more than 200 countries and territories turn to Google Cloud as their trusted partner to enable growth and solve their most critical business problems.The US base salary range for this full-time position is $150,000-$238,000 + bonus + equity + benefits. Our salary ranges are determined by role, level, and location. The range displayed on each job posting reflects the minimum and maximum target for new hire salaries for the position across all US locations. Within the range, individual pay is determined by work location and additional factors, including job-related skills, experience, and relevant education or training. Your recruiter can share more about the specific salary range for your preferred location during the hiring process. Please note that the compensation details listed in US role postings reflect the base salary only, and do not include bonus, equity, or benefits."
"
      Senior Product Manager, Google Cloud
    ",https://careers.google.com/jobs/results/97854180976140998-senior-product-manager-google-cloud/?distance=50&page=3&q=Machine%20Learning,Google,"
Bachelor's degree or equivalent practical experience.
8 years of experience in product management, co-founder or related technical role.
3 years of experience building and shipping technical products.
Experience developing/launching products/technologies within one or more of the following: Cloud, SaaS, enterprise, internal tools, and/or supply chain networks.
","
3 years of people management experience with direct reports.
Experience driving product vision, go-to-market strategy, and design discussions.
Experience managing day-to-day technical and design direction.
Experience in one or more of the following: cloud infrastructure, SaaS, big data, security and privacy, development and operations, or artificial intelligence/machine learning.
Knowledge of multiple functional areas such as Product Management, Engineering, UX/UI, Sales, Customer Support, Finance, or Marketing.
Ability to influence multiple stakeholders without direct authority.
","At Google, we put our users first. The world is always changing, so we need Product Managers who are continuously adapting and excited to work on products that affect millions of people every day. In this role, you will work cross-functionally to guide products from conception to launch by connecting the technical and business worlds. You can break down complex problems into steps that drive product development.One of the many reasons Google consistently brings innovative, world-changing products to market is because of the collaborative work we do in Product Management. Our team works closely with creative engineers, designers, marketers, etc. to help design and develop technologies that improve access to the world's information.  We're responsible for guiding products throughout the execution cycle, focusing specifically on analyzing, positioning, packaging, promoting, and tailoring our solutions to our users.
Google Cloud helps employees and organizations empower their employees, serve their customers, and build what’s next for their business. As a Google Cloud Senior Product Manager, you will drive product strategy and partner closely with cross-functional teams to define and deliver on the next phase of cloud services. Additionally, you will develop product solutions, Mergers and Acquisitions, go-to-market, and business relationships to execute on the market potential and benefits possible from applying Google’s technologies in the enterprise market.By applying to this role, you'll be considered for all teams working on Enterprise, including Google Cloud Platform, Google Workspace, Unified Fulfillment Optimization, Google Cloud Systems, Google Cloud Security, Business Application Platform, Google Cloud AI/ML, Developer Product Group, and Internal Tools.Google Cloud accelerates organizations’ ability to digitally transform their business with the best infrastructure, platform, industry solutions and expertise. We deliver enterprise-grade solutions that leverage Google’s cutting-edge technology – all on the cleanest cloud in the industry. Customers in more than 200 countries and territories turn to Google Cloud as their trusted partner to enable growth and solve their most critical business problems.
The US base salary range for this full-time position is $153,000-$242,000 + bonus + equity + benefits. Our salary ranges are determined by role, level, and location. The range displayed on each job posting reflects the minimum and maximum target for new hire salaries for the position across all US locations. Within the range, individual pay is determined by work location and additional factors, including job-related skills, experience, and relevant education or training. Your recruiter can share more about the specific salary range for your preferred location during the hiring process.
Please note that the compensation details listed in US role postings reflect the base salary only, and do not include bonus, equity, or benefits."
"
      Technical Solutions Consultant, Telecommunications, Data
    ",https://careers.google.com/jobs/results/107082676340433606-technical-solutions-consultant-telecommunications-data/?distance=50&page=3&q=Machine%20Learning,Google,"
Bachelor’s degree in a technical field or equivalent practical experience.
10 years of experience in a related solutions or software development role.
Experience driving product insight including go-to-market strategy, design discussions, creating product road-maps and working cross-functionally.
Experience in telecommunications Network including operational system support (OSS) and business system support (BSS) technology environments.
","
Experience in one or more of the following: cloud infrastructure, SaaS, big data, security and privacy, development and operations.
Experience operating in a global role on a global scale.
Experience developing and launching products/technologies within cloud, SaaS, enterprise, or supply chain networks.
Experience with building and using Artificial Intelligence for various use cases like tabular data, images, video, speech, and unstructured text.
Experience working in an enterprise technology setting, bringing both demonstrated expertise in SaaS around unified communications, content and collaboration, meetings, and understanding of the cloud market and competitive dynamics.
Ability to influence multiple stakeholders.
","
Google Cloud helps many employees and organizations empower their employees, serve their customers, and build what’s next for their business with technology built in the cloud. Our products are engineered for security, reliability, and scalability, from infrastructure to applications to devices and hardware. As a Technical Solutions Consultant, you'll set the insight, mission, and strategy. You will meet with Google Cloud Telecommunications customers to facilitate digital transformation and network transformation. In this role, you'll identify industry trends in cloud computing to recommend, plan, and address market opportunities with solutions. You'll leverage Artificial Intelligence (AI), Machine Learning (ML), and analytics to develop solutions and create business value. You will ensure technical and commercial readiness for solutions. You will set goals and measurements for solutions adoption, and recommendations for market implementation.In this role, you will be focused on putting our customers first. Intuitively anticipating their needs before they even arise, you will be able to go beyond standard market research to predict where the market is trending and where future opportunities lie. Utilizing insights and data to influence product strategy and investment, you will develop solutions from the ground-up, organize solution launches, and create a repeatable go-to-market process.Working cross-functionally, you will drive alignment across the sales, product management, engineering and product marketing functions to deliver solutions for the customer. Gathering customer insights and feedback, you will infuse this learning back into the organization and product area roadmap, ensuring effective product launches, and differentiated features.Google Cloud accelerates organizations’ ability to digitally transform their business with the best infrastructure, platform, industry solutions and expertise. We deliver enterprise-grade solutions that leverage Google’s cutting-edge technology – all on the cleanest cloud in the industry. Customers in more than 200 countries and territories turn to Google Cloud as their trusted partner to enable growth and solve their most critical business problems.
The US base salary range for this full-time position is $150,000-$238,000 + bonus + equity + benefits. Our salary ranges are determined by role, level, and location. The range displayed on each job posting reflects the minimum and maximum target for new hire salaries for the position across all US locations. Within the range, individual pay is determined by work location and additional factors, including job-related skills, experience, and relevant education or training. Your recruiter can share more about the specific salary range for your preferred location during the hiring process.
Please note that the compensation details listed in US role postings reflect the base salary only, and do not include bonus, equity, or benefits."
"
      Software Engineer, Silicon
    ",https://careers.google.com/jobs/results/97596661380850374-software-engineer-silicon/?distance=50&page=3&q=Machine%20Learning,Google,"
Bachelor’s degree in Computer Science, Electrical Engineering, related technical field or equivalent practical experience.
Experience in the field of software engineering (i.e. working with data structures, algorithms, software design).
Experience in Software development, one or more programming languages (e,g., C/C++, Java or Python).
","
Master's or PhD degree in Computer Science, Electrical Engineering, or related technical field, specializing in computer architecture, operating system, compilers, or hardware-software codesign.
Experience in compiler design and implementation, image/video/speech algorithms, and software/hardware implementation techniques.
Experience in programming domain-specific accelerators, including GPU, TPU, or DSP.
Experience in Android operating system, framework, and application.
Experience in machine learning software stack and hardware architecture.
Experience in system power and performance benchmark, profiling, analysis, and optimization.
","Google's software engineers develop the next-generation technologies that change how billions of users connect, explore, and interact with information and one another. Our products need to handle information at massive scale, and extend well beyond web search. We're looking for engineers who bring fresh ideas from all areas, including information retrieval, distributed computing, large-scale system design, networking and data storage, security, artificial intelligence, natural language processing, UI design and mobile; the list goes on and is growing every day. As a software engineer, you will work on a specific project critical to Google’s needs with opportunities to switch teams and projects as you and our fast-paced business grow and evolve. We need our engineers to be versatile, display leadership qualities and be enthusiastic to take on new problems across the full-stack as we continue to push technology forward."
"
      Cloud Data Engineer, Professional Services, Google Cloud
    ",https://careers.google.com/jobs/results/81245317158052550-cloud-data-engineer-professional-services-google-cloud/?distance=50&page=3&q=Machine%20Learning,Google,"
Bachelor's degree in Computer Science, Mathematics, related technical field, or equivalent practical experience.
Experience with data processing software (e.g., Hadoop, Spark, Pig, Hive) and algorithms (e.g., MapReduce, Flume).
Experience coding in one or more languages: Java, C++, Python, Go, JavaScript.
Experience managing client-facing projects, troubleshooting technical issues, working with Engineering, Sales, Services, and customers.
","
Experience working with data warehouses, including data warehouse technical architectures, infrastructure components, ETL/ELT, and reporting/analytic tools and environments.
Experience in technical consulting.

Experience working with Big Data, information retrieval, data mining, or machine learning.
Experience in building multi-tier high availability applications with modern web technologies (e.g., NoSQL, MongoDB, SparkML, TensorFlow).
Experience architecting, developing software, or internet scale production-grade Big Data solutions in virtualized environments.
","The Google Cloud Platform team helps customers transform and evolve their business through the use of Google’s global network, web-scale data centers, and software infrastructure. As part of an entrepreneurial team in this rapidly growing business, you will help shape the future of businesses of all sizes using technology to connect with customers, employees, and partners.As a Data Engineer, you'll guide customers on how to ingest, store, process, analyze, and explore/visualize data on the Google Cloud Platform. You will work on data migrations and transformational projects, and with customers to design large-scale data processing systems, develop data pipelines optimized for scaling, and troubleshoot potential platform challenges. In this role, you will be working with Google's strategic Cloud customers, and with the team you will support customer implementation of Google Cloud products.Google Cloud accelerates organizations’ ability to digitally transform their business with the best infrastructure, platform, industry solutions and expertise. We deliver enterprise-grade solutions that leverage Google’s cutting-edge technology – all on the cleanest cloud in the industry. Customers in more than 200 countries and territories turn to Google Cloud as their trusted partner to enable growth and solve their most critical business problems.The US base salary range for this full-time position is $107,000-$163,000 + bonus + equity + benefits. Our salary ranges are determined by role, level, and location. The range displayed on each job posting reflects the minimum and maximum target for new hire salaries for the position across all US locations. Within the range, individual pay is determined by work location and additional factors, including job-related skills, experience, and relevant education or training. Your recruiter can share more about the specific salary range for your preferred location during the hiring process.Please note that the compensation details listed in US role postings reflect the base salary only, and do not include bonus, equity, or benefits."
"
      Hardware Engineering Intern, Spring or Summer 2023
    ",https://careers.google.com/jobs/results/77422625942315718-hardware-engineering-intern-spring-or-summer-2023/?distance=50&page=3&q=Machine%20Learning,Google,"
Currently pursuing a Bachelor’s degree in Electrical Engineering, Computer Engineering, Computer Science, Acoustics, Audio Sciences, Physics or a related field.
Experience in one or more of the following areas: Acoustics, Artificial Intelligence, ASIC Design, Computer Architecture, Circuit Design, Design Verification, Digital Design, Embedded Systems, Hardware/Software, Machine Learning, Mixed-signal Circuit Design, Programming, Signal and Power Integrity, Statistics, System Modeling, Test/Measurement and/or Verilog.
","
Currently pursuing a Master’s or PhD in Electrical Engineering, Computer Engineering, Computer Science, Acoustics, Audio Sciences, Physics or a related field and returning to a degree program after the internship ends.

Experience (e.g., research assistant, teaching assistant, personal projects outside the classroom, etc.) in Hardware, Electrical Engineering, Mechanical Engineering, Communication Engineering, Ocean Engineering, Optical Engineering, or other related filed.
Knowledge and experience in test/design/ manufacturing/prototyping tools.
Excellent coding skills.
","As a Hardware Engineering Intern, you design and build the systems for computing infrastructure. Your work has the potential to shape the machinery that goes into data centers affecting Google users.
 
The teams you will work with design, develop, and deploy next-generation consumer hardware while ensuring that this equipment is reliable. You’ll work closely with engineers to improve our hardware to meet Google's standards of quality and reliability. Your work will have the potential to impact many of Google users. Depending on your experience, you may have an opportunity to work on a project in Electrical Hardware Engineering, SIPI, System Hardware Engineering, or Validation. 
"
